{
  "fixture_contract_version": "1.0",
  "fixture_id": "sysmon-event1-ordinary-powershell-001",
  "source_format": "sysmon_eventlog_json",
  "provider_name": "Microsoft-Windows-Sysmon",
  "provider_guid": "{44444444-4444-4444-4444-444444444444}",
  "provider_event_id": 1,
  "event_version": 5,
  "event_level": 4,
  "event_task": 1,
  "event_opcode": 0,
  "event_keywords": "0x8000000000000000",
  "event_record_id": 41001,
  "computer": "WIN-FIXTURE01",
  "channel": "Microsoft-Windows-Sysmon/Operational",
  "system_time": "2026-01-15T01:02:03.123000Z",
  "utc_time": "2026-01-15T01:02:03.123000Z",
  "process_guid": "{11111111-1111-1111-1111-111111111111}",
  "process_id": 4100,
  "image": "C:\\Windows\\System32\\WindowsPowerShell\\v1.0\\powershell.exe",
  "file_version": "10.0.0.0",
  "description": "Synthetic PowerShell fixture",
  "product": "Synthetic Windows fixture",
  "company": "Example Lab",
  "original_file_name": "PowerShell.EXE",
  "command_line": "powershell.exe -NoProfile -Command \"Write-Output fixture-ok\"",
  "current_directory": "C:\\LabFixture\\",
  "user": "LAB\\fixture-user",
  "logon_guid": "{11111111-1111-1111-1111-111111111113}",
  "logon_id": "0x123ABC",
  "terminal_session_id": 1,
  "integrity_level": "Medium",
  "hashes": {
    "SHA256": "AAAAAAAAAAAAAAAAAAAAAAAAAAAAAAAAAAAAAAAAAAAAAAAAAAAAAAAAAAAAAAAA"
  },
  "parent_process_guid": "{11111111-1111-1111-1111-111111111112}",
  "parent_process_id": 4000,
  "parent_image": "C:\\Windows\\System32\\cmd.exe",
  "parent_command_line": "cmd.exe",
  "parent_user": "LAB\\fixture-user"
}
