{
  "fixture_contract_version": "1.0",
  "fixture_id": "sysmon-event1-ordinary-notepad-001",
  "source_format": "sysmon_eventlog_json",
  "provider_name": "Microsoft-Windows-Sysmon",
  "provider_guid": "{44444444-4444-4444-4444-444444444444}",
  "provider_event_id": 1,
  "event_version": 5,
  "event_level": 4,
  "event_task": 1,
  "event_opcode": 0,
  "event_keywords": "0x8000000000000000",
  "event_record_id": 41003,
  "computer": "WIN-FIXTURE01",
  "channel": "Microsoft-Windows-Sysmon/Operational",
  "system_time": "2026-01-15T01:04:03.123000Z",
  "utc_time": "2026-01-15T01:04:03.123000Z",
  "process_guid": "{33333333-3333-3333-3333-333333333331}",
  "process_id": 4300,
  "image": "C:\\Windows\\System32\\notepad.exe",
  "file_version": "10.0.0.0",
  "description": "Synthetic Notepad fixture",
  "product": "Synthetic Windows fixture",
  "company": "Example Lab",
  "original_file_name": "NOTEPAD.EXE",
  "command_line": "notepad.exe C:\\LabFixture\\readme.txt",
  "current_directory": "C:\\LabFixture\\",
  "user": "LAB\\fixture-user",
  "logon_guid": "{33333333-3333-3333-3333-333333333333}",
  "logon_id": "0x123ABC",
  "terminal_session_id": 1,
  "integrity_level": "Medium",
  "hashes": {
    "SHA256": "CCCCCCCCCCCCCCCCCCCCCCCCCCCCCCCCCCCCCCCCCCCCCCCCCCCCCCCCCCCCCCCC"
  },
  "parent_process_guid": "{33333333-3333-3333-3333-333333333332}",
  "parent_process_id": 3900,
  "parent_image": "C:\\Windows\\explorer.exe",
  "parent_command_line": "explorer.exe",
  "parent_user": "LAB\\fixture-user"
}
